{
  "$schema": "https://json-schema.org/draft/2020-12/schema",
  "$id": "https://collegedash.local/schema/profile.schema.json",
  "title": "CollegeDash program profile",
  "type": "object",
  "required": ["slug", "name", "conference", "program", "seasons", "commitments", "curated", "academicRank", "_build"],
  "properties": {
    "slug": {"type": "string", "pattern": "^[a-z0-9-]+$"},
    "name": {"type": "string", "minLength": 1},
    "shortName": {"type": ["string", "null"]},
    "nickname": {"type": ["string", "null"]},
    "division": {"type": "string"},
    "conference": {"type": ["string", "null"]},
    "colors": {"type": ["array", "null"], "items": {"type": "string"}},
    "ids": {"type": "object"},
    "social": {"type": "object"},
    "links": {"type": "object"},
    "school": {
      "type": ["object", "null"],
      "properties": {
        "city": {"type": ["string", "null"]},
        "state": {"type": ["string", "null"]},
        "lat": {"type": ["number", "null"]},
        "lon": {"type": ["number", "null"]},
        "admissionRate": {"type": ["number", "null"], "minimum": 0, "maximum": 1},
        "undergradEnrollment": {"type": ["integer", "null"]},
        "_meta": {"$ref": "#/$defs/meta"}
      }
    },
    "academicRank": {
      "type": "object",
      "description": "The university's place in Times Higher Education's Best universities in the United States table, from the committed data/the-us-rankings-2026.json. Required, and required even when rank is null: 224 of the 350 programs are genuinely unranked, so a block that is simply absent because the asset failed to load would be indistinguishable from one that is honestly empty.",
      "required": ["rank", "tied", "theSlug", "year", "label", "source", "sourceUrl", "asOf"],
      "properties": {
        "rank": {"type": ["integer", "null"], "minimum": 1, "description": "US Rank 2026; null = not among the universities THE ranks"},
        "tied": {"type": "boolean", "description": "THE prints a tied rank as '=39'; 124 of its 171 rows are ties"},
        "theSlug": {"type": ["string", "null"], "description": "the asset row this rank came from; null when unranked"},
        "year": {"type": "integer"},
        "label": {"type": "string"},
        "source": {"type": "string"},
        "sourceUrl": {"type": "string"},
        "asOf": {"type": ["string", "null"]}
      }
    },
    "climate": {
      "type": ["object", "null"],
      "properties": {
        "monthly": {"type": "array", "minItems": 12, "maxItems": 12,
          "items": {"type": "object", "required": ["month", "tHighF", "tLowF", "precipIn"],
            "properties": {"month": {"type": "string"}, "tHighF": {"type": ["number", "null"]}, "tLowF": {"type": ["number", "null"]},
              "precipIn": {"type": ["number", "null"]}, "snowIn": {"type": ["number", "null"]}, "wetDays": {"type": ["number", "null"]},
              "days90F": {"type": ["number", "null"]}, "daysFreeze": {"type": ["number", "null"]}}}},
        "station": {"type": ["object", "null"], "description": "NOAA NCEI normals station the values come from",
          "properties": {"id": {"type": "string"}, "name": {"type": ["string", "null"]}, "distanceKm": {"type": ["number", "null"]},
            "elevationM": {"type": ["number", "null"]}}},
        "summary": {"type": "string"},
        "_meta": {"$ref": "#/$defs/meta"}
      }
    },
    "program": {
      "type": "object",
      "required": ["headCoach", "nationalTitles"],
      "properties": {
        "headCoach": {"type": "object", "properties": {"name": {"type": ["string", "null"]}, "source": {"enum": ["athletics", "wikipedia", null]}, "since": {"type": ["integer", "null"]}}},
        "coaches": {"type": "array"},
        "stadium": {"type": ["object", "null"]},
        "nationalTitles": {"type": "array", "items": {"type": "integer"}},
        "unsourcedTitleClaims": {"type": "array", "items": {"type": "integer"}},
        "collegeCups": {"type": "array", "items": {"type": "integer"}}
      }
    },
    "seasons": {
      "type": "array",
      "items": {
        "type": "object",
        "required": ["year"],
        "properties": {
          "year": {"type": "integer", "minimum": 1950, "maximum": 2100},
          "record": {"type": ["string", "null"], "pattern": "^\\d+-\\d+-\\d+$"},
          "rpiRank": {"type": ["integer", "null"], "minimum": 1},
          "gamesPlayed": {"type": "integer", "minimum": 1, "description": "Games with a result behind `record`, exhibitions excluded. Present exactly when `record` is (issue #287)."},
          "recordSource": {"enum": ["schedule", "wikipedia", "wikipedia-swapped", "ncaa-rpi-d1"], "description": "Where `record` and `confRecord` come from: the athletics schedule, Wikipedia, Wikipedia with its overall and conference columns swapped back, or the NCAA RPI table (Division I games only)."}
        }
      }
    },
    "roster": {
      "type": ["object", "null"],
      "required": ["season", "players", "byPosClass"],
      "properties": {
        "players": {"type": "array", "items": {"type": "object", "required": ["name", "pos", "classCode"]}}
      }
    },
    "rosterHistory": {"type": "object"},
    "schedule": {"type": ["object", "null"]},
    "commitments": {
      "type": "array",
      "items": {
        "type": "object",
        "required": ["id", "name", "gradYear", "college", "status", "confidence", "sources"],
        "properties": {
          "gradYear": {"type": "integer", "minimum": 2020, "maximum": 2040},
          "status": {"enum": ["verbal", "signed", "enrolled", "decommitted"]},
          "confidence": {"enum": ["confirmed", "single-source", "unreviewed"]},
          "announced": {"type": ["string", "null"], "pattern": "^\\d{4}-\\d{2}-\\d{2}$"},
          "sources": {"type": "array", "minItems": 1, "items": {"type": "object", "required": ["kind"]}}
        }
      }
    },
    "news": {"type": ["object", "null"]},
    "camps": {
      "type": ["object", "null"],
      "description": "ID camps: the program's camp page plus dated camps from that page (kind camp), news releases (kind news) and curated.json (kind curated). Missing = camps collector has not run; the UI derives upcoming/past from today's date.",
      "required": ["items", "_meta"],
      "properties": {
        "url": {"type": ["string", "null"]},
        "hubUrl": {"type": ["string", "null"]},
        "finalUrl": {"type": ["string", "null"]},
        "host": {"type": ["string", "null"]},
        "vendor": {"type": ["string", "null"]},
        "discoveredVia": {"type": ["string", "null"], "enum": ["registry", "anchor", "json", null]},
        "robotsBlocked": {"type": "boolean"},
        "hostRefused": {"type": "boolean", "description": "the camp host refused us (HTTP 403/429, recorded and not re-requested); absent before issue #79"},
        "unreadable": {"type": ["object", "null"], "description": "issue #79: null, or why a camp page with nothing dated could not be read (build.camp_readability)",
          "required": ["cause"], "additionalProperties": false,
          "properties": {"cause": {"enum": ["app-shell", "not-a-listing", "not-html"]}}},
        "parsed": {"type": ["boolean", "null"], "description": "false = the camp page was fetched but could not be read (PDF, empty or non-HTML body); null = collected before the flag existed"},
        "items": {"type": "array", "items": {"type": "object", "required": ["name", "kind"],
          "properties": {
            "name": {"type": "string", "minLength": 1},
            "kind": {"enum": ["camp", "news", "curated"]},
            "startDate": {"type": ["string", "null"], "pattern": "^\\d{4}-\\d{2}(-\\d{2})?$"},
            "endDate": {"type": ["string", "null"], "pattern": "^\\d{4}-\\d{2}(-\\d{2})?$"},
            "dateText": {"type": ["string", "null"]},
            "precision": {"enum": ["day", "month", null]},
            "yearInferred": {"type": "boolean"},
            "location": {"type": ["string", "null"]}, "ages": {"type": ["string", "null"]}, "price": {"type": ["string", "null"]},
            "registerUrl": {"type": ["string", "null"]}, "sourceUrl": {"type": ["string", "null"]},
            "confidence": {"enum": ["heuristic", "curated", "vendor"]}
          }}},
        "_meta": {"type": "array", "items": {"$ref": "#/$defs/meta"}}
      }
    },
    "curated": {"type": "object"},
    "commitmentsByYear": {"type": "object"},
    "_build": {
      "type": "object",
      "required": ["builtAt", "completeness", "sections", "stale"],
      "properties": {
        "completeness": {"type": "number", "minimum": 0, "maximum": 1},
        "failed": {"type": "array", "description": "collector runs whose last attempt failed (from refresh-state)",
          "items": {"type": "object", "required": ["collector", "error"],
            "properties": {"collector": {"type": "string"}, "error": {"type": "string"}, "at": {"type": ["string", "null"]}}}},
        "skipped": {"type": "array", "description": "collectors with nothing to collect (no article, no TDS id, browser-only roster)",
          "items": {"type": "object", "required": ["collector", "reason"],
            "properties": {"collector": {"type": "string"}, "reason": {"type": "string"}, "at": {"type": ["string", "null"]}}}}
      }
    }
  },
  "$defs": {
    "meta": {
      "type": ["object", "null"],
      "properties": {"source": {"type": ["string", "null"]}, "url": {"type": ["string", "null"]}, "asOf": {"type": ["string", "null"]}}
    }
  }
}
