{
  "slug": "lesley",
  "name": "Lesley University",
  "shortName": "Lesley",
  "nickname": "Lynx",
  "division": "D3",
  "conference": "North Atlantic Conference",
  "colors": null,
  "ids": {
    "ncaaOrgId": 24317,
    "scorecardUnitId": 166452,
    "tdsClgId": null,
    "tdsSlug": null,
    "wikipedia": null,
    "ncaaName": null,
    "ncaaSlug": null,
    "rpiHistoryName": null
  },
  "social": {
    "x": null,
    "instagram": null
  },
  "links": {
    "athletics": "https://lesleyathletics.com/sports/womens-soccer",
    "roster": "https://lesleyathletics.com/sports/womens-soccer/roster",
    "schedule": "https://lesleyathletics.com/sports/womens-soccer/schedule",
    "news": "https://lesleyathletics.com/sports/womens-soccer/news",
    "camps": null,
    "tds": null,
    "wikipedia": null,
    "x": null,
    "instagram": null
  },
  "school": {
    "unitId": 166452,
    "name": "Lesley University",
    "city": "Cambridge",
    "state": "MA",
    "zip": "02138-2790",
    "website": "www.lesley.edu/",
    "lat": 42.38012,
    "lon": -71.117303,
    "localeCode": 12,
    "locale": "City: Midsize",
    "carnegieCode": 17,
    "carnegie": "Doctoral/Professional",
    "ownership": "Private nonprofit",
    "religiousAffiliation": null,
    "undergradEnrollment": 1122,
    "gradEnrollment": null,
    "admissionRate": 0.9687,
    "sat25": null,
    "sat75": null,
    "satAverage": null,
    "act25": null,
    "act75": null,
    "tuitionInState": 34256,
    "tuitionOutOfState": 34256,
    "costOfAttendance": 51538,
    "netPriceAverage": 31152,
    "gradRate6yr": 0.5802,
    "retentionRate": 0.7228,
    "medianEarnings10yr": 51173,
    "region": "Northeast",
    "_meta": {
      "source": "scorecard",
      "url": "https://api.data.gov/ed/collegescorecard/v1/schools?id=166452",
      "asOf": "2026-09-23T20:46:48Z"
    }
  },
  "academicRank": {
    "rank": null,
    "tied": false,
    "theSlug": null,
    "year": 2026,
    "label": "US Rank 2026",
    "source": "Times Higher Education",
    "sourceUrl": "https://www.timeshighereducation.com/student/best-universities/best-universities-united-states",
    "asOf": "2026-09-11T14:04:40Z"
  },
  "climate": {
    "lat": 42.38012,
    "lon": -71.117303,
    "timezone": "America/New_York",
    "elevationM": 3.7,
    "normalsPeriod": "1991-2020",
    "station": {
      "id": "USW00014739",
      "name": "BOSTON LOGAN INTL AP",
      "state": "MA",
      "distanceKm": 9.0,
      "elevationM": 3.7
    },
    "monthly": [
      {
        "month": "Jan",
        "tHighF": 36.8,
        "tLowF": 23.1,
        "precipIn": 3.39,
        "snowIn": 14.3,
        "wetDays": 6.6,
        "days90F": 0.0,
        "daysFreeze": 24.8
      },
      {
        "month": "Feb",
        "tHighF": 39.0,
        "tLowF": 24.6,
        "precipIn": 3.21,
        "snowIn": 14.4,
        "wetDays": 6.2,
        "days90F": 0.0,
        "daysFreeze": 21.7
      },
      {
        "month": "Mar",
        "tHighF": 45.5,
        "tLowF": 31.1,
        "precipIn": 4.17,
        "snowIn": 9.0,
        "wetDays": 6.9,
        "days90F": 0.0,
        "daysFreeze": 16.2
      },
      {
        "month": "Apr",
        "tHighF": 56.4,
        "tLowF": 40.8,
        "precipIn": 3.63,
        "snowIn": 1.6,
        "wetDays": 6.7,
        "days90F": 0.1,
        "daysFreeze": 2.1
      },
      {
        "month": "May",
        "tHighF": 66.5,
        "tLowF": 50.3,
        "precipIn": 3.25,
        "snowIn": 0.0,
        "wetDays": 6.8,
        "days90F": 0.6,
        "daysFreeze": 0.0
      },
      {
        "month": "Jun",
        "tHighF": 76.2,
        "tLowF": 59.7,
        "precipIn": 3.89,
        "snowIn": 0.0,
        "wetDays": 6.7,
        "days90F": 2.5,
        "daysFreeze": 0.0
      },
      {
        "month": "Jul",
        "tHighF": 82.1,
        "tLowF": 66.0,
        "precipIn": 3.27,
        "snowIn": 0.0,
        "wetDays": 6.1,
        "days90F": 6.3,
        "daysFreeze": 0.0
      },
      {
        "month": "Aug",
        "tHighF": 80.4,
        "tLowF": 65.1,
        "precipIn": 3.23,
        "snowIn": 0.0,
        "wetDays": 5.4,
        "days90F": 3.8,
        "daysFreeze": 0.0
      },
      {
        "month": "Sep",
        "tHighF": 73.1,
        "tLowF": 58.2,
        "precipIn": 3.56,
        "snowIn": 0.0,
        "wetDays": 6.0,
        "days90F": 0.8,
        "daysFreeze": 0.0
      },
      {
        "month": "Oct",
        "tHighF": 62.1,
        "tLowF": 47.5,
        "precipIn": 4.03,
        "snowIn": 0.2,
        "wetDays": 6.0,
        "days90F": 0.0,
        "daysFreeze": 0.2
      },
      {
        "month": "Nov",
        "tHighF": 51.6,
        "tLowF": 37.9,
        "precipIn": 3.66,
        "snowIn": 0.7,
        "wetDays": 6.4,
        "days90F": 0.0,
        "daysFreeze": 6.8
      },
      {
        "month": "Dec",
        "tHighF": 42.2,
        "tLowF": 29.2,
        "precipIn": 4.3,
        "snowIn": 9.0,
        "wetDays": 7.2,
        "days90F": 0.0,
        "daysFreeze": 19.8
      }
    ],
    "annualPrecipIn": 43.6,
    "annualSnowIn": 49.2,
    "fallSeason": {
      "avgHighF": 66.8,
      "avgLowF": 52.2,
      "precipIn": 14.5,
      "wetDays": 24.0
    },
    "summary": "Hottest month Jul (avg high 82.1°F), coldest Jan (avg low 23.1°F). 43.6 in of rain per year, 49.2 in of snow. Fall season (Aug–Nov): highs around 66.8°F, 14.5 in of rain over the season.",
    "_meta": {
      "source": "climate",
      "url": "https://www.ncei.noaa.gov/access/services/data/v1?dataset=normals-monthly-1991-2020&stations=USW00014739,USW00014702,USC00193890&dataTypes=MLY-TMAX-NORMAL,MLY-TMIN-NORMAL,MLY-PRCP-NORMAL,MLY-SNOW-NORMAL,MLY-PRCP-AVGNDS-GE010HI,MLY-TMAX-AVGNDS-GRTH090,MLY-TMIN-AVGNDS-LSTH032&format=json&units=standard",
      "asOf": "2026-09-23T20:46:51Z"
    }
  },
  "program": {
    "headCoach": {
      "name": null,
      "source": null,
      "title": null,
      "since": null,
      "seasons": null,
      "bioUrl": null,
      "social": {}
    },
    "coaches": [],
    "supportStaff": [],
    "stadium": null,
    "founded": null,
    "nationalTitles": [],
    "nationalRunnerUp": [],
    "collegeCups": [],
    "ncaaAppearances": [],
    "confRegularSeasonTitles": [],
    "confTournamentTitles": [],
    "allTimeRecord": {
      "wins": 0,
      "losses": 0,
      "ties": 0,
      "winPct": null,
      "seasons": 0
    },
    "_meta": {
      "wikipedia": null,
      "athletics": null
    }
  },
  "seasons": [],
  "roster": null,
  "rosterHistory": {},
  "schedule": null,
  "commitments": [],
  "news": null,
  "camps": null,
  "curated": {},
  "commitmentsByYear": {},
  "_build": {
    "builtAt": "2026-10-21T16:22:15Z",
    "completeness": 0.22,
    "sections": {
      "school": true,
      "climate": true,
      "program": false,
      "seasons": false,
      "rpi": false,
      "roster": false,
      "schedule": false,
      "commitments": false,
      "news": false
    },
    "stale": [],
    "failed": [],
    "skipped": [
      {
        "collector": "athletics",
        "reason": "athletics: athletics site refuses CollegeDashBot: HTTP 403 for https://lesleyathletics.com/sports/womens-soccer/roster on one request in onboard run 35918192860 (d3-b9, 2026-09-23), and again in the retry run 35923659056 (2026-09-23); not worked around, #94 (registry athletics.skipReason)",
        "at": "2026-10-21T16:13:30Z"
      },
      {
        "collector": "camps",
        "reason": "camps: athletics site refuses CollegeDashBot: HTTP 403 for https://lesleyathletics.com/sports/womens-soccer/roster on one request in onboard run 35918192860 (d3-b9, 2026-09-23), and again in the retry run 35923659056 (2026-09-23); not worked around, #94 (registry athletics.skipReason)",
        "at": "2026-10-21T16:13:34Z"
      },
      {
        "collector": "news",
        "reason": "news: athletics site refuses CollegeDashBot: HTTP 403 for https://lesleyathletics.com/sports/womens-soccer/roster on one request in onboard run 35918192860 (d3-b9, 2026-09-23), and again in the retry run 35923659056 (2026-09-23); not worked around, #94 (registry athletics.skipReason)",
        "at": "2026-10-21T16:13:34Z"
      },
      {
        "collector": "tds",
        "reason": "tds: no TopDrawerSoccer team id in the registry (set ids.tdsClgId + ids.tdsSlug)",
        "at": "2026-10-21T16:13:30Z"
      },
      {
        "collector": "wikipedia",
        "reason": "wikipedia: no team article in the registry (most mid-majors have none; try `registry fix-wiki`)",
        "at": "2026-10-19T17:47:28Z"
      }
    ]
  }
}
