{
  "slug": "bluffton",
  "name": "Bluffton University",
  "shortName": "Bluffton",
  "nickname": "Beavers",
  "division": "D3",
  "conference": "Heartland Collegiate Athletic Conference",
  "colors": null,
  "ids": {
    "ncaaOrgId": 987,
    "scorecardUnitId": 201371,
    "tdsClgId": null,
    "tdsSlug": null,
    "wikipedia": null,
    "ncaaName": null,
    "ncaaSlug": null,
    "rpiHistoryName": null
  },
  "social": {
    "x": null,
    "instagram": null
  },
  "links": {
    "athletics": "https://www.blufftonbeavers.com/sports/womens-soccer",
    "roster": "https://www.blufftonbeavers.com/sports/womens-soccer/roster",
    "schedule": "https://www.blufftonbeavers.com/sports/womens-soccer/schedule",
    "news": "https://www.blufftonbeavers.com/sports/womens-soccer/news",
    "camps": null,
    "tds": null,
    "wikipedia": null,
    "x": null,
    "instagram": null
  },
  "school": {
    "unitId": 201371,
    "name": "Bluffton University",
    "city": "Bluffton",
    "state": "OH",
    "zip": "45817-2104",
    "website": "www.bluffton.edu/",
    "lat": 40.895606,
    "lon": -83.899439,
    "localeCode": 42,
    "locale": "Rural: Distant",
    "carnegieCode": 22,
    "carnegie": "Baccalaureate: Diverse Fields",
    "ownership": "Private nonprofit",
    "religiousAffiliation": 69,
    "undergradEnrollment": 582,
    "gradEnrollment": null,
    "admissionRate": 0.6723,
    "sat25": 860,
    "sat75": 1130,
    "satAverage": 976,
    "act25": 16,
    "act75": 22,
    "tuitionInState": 37362,
    "tuitionOutOfState": 37362,
    "costOfAttendance": 51862,
    "netPriceAverage": 19943,
    "gradRate6yr": 0.5294,
    "retentionRate": 0.5957,
    "medianEarnings10yr": 49547,
    "region": "Midwest",
    "_meta": {
      "source": "scorecard",
      "url": "https://api.data.gov/ed/collegescorecard/v1/schools?id=201371",
      "asOf": "2026-09-23T19:04:58Z"
    }
  },
  "academicRank": {
    "rank": null,
    "tied": false,
    "theSlug": null,
    "year": 2026,
    "label": "US Rank 2026",
    "source": "Times Higher Education",
    "sourceUrl": "https://www.timeshighereducation.com/student/best-universities/best-universities-united-states",
    "asOf": "2026-09-11T14:04:40Z"
  },
  "climate": {
    "lat": 40.895606,
    "lon": -83.899439,
    "timezone": "America/New_York",
    "elevationM": 243.8,
    "normalsPeriod": "1991-2020",
    "station": {
      "id": "USW00014825",
      "name": "FINDLAY AP",
      "state": "OH",
      "distanceKm": 23.4,
      "elevationM": 243.8
    },
    "monthly": [
      {
        "month": "Jan",
        "tHighF": 35.1,
        "tLowF": 20.4,
        "precipIn": 2.05,
        "snowIn": null,
        "wetDays": 4.8,
        "days90F": 0.0,
        "daysFreeze": 26.3
      },
      {
        "month": "Feb",
        "tHighF": 38.4,
        "tLowF": 22.7,
        "precipIn": 1.68,
        "snowIn": null,
        "wetDays": 4.0,
        "days90F": 0.0,
        "daysFreeze": 23.6
      },
      {
        "month": "Mar",
        "tHighF": 48.9,
        "tLowF": 30.6,
        "precipIn": 2.33,
        "snowIn": null,
        "wetDays": 5.9,
        "days90F": 0.0,
        "daysFreeze": 19.7
      },
      {
        "month": "Apr",
        "tHighF": 62.2,
        "tLowF": 40.6,
        "precipIn": 3.42,
        "snowIn": null,
        "wetDays": 7.2,
        "days90F": 0.0,
        "daysFreeze": 6.0
      },
      {
        "month": "May",
        "tHighF": 73.3,
        "tLowF": 51.8,
        "precipIn": 3.75,
        "snowIn": null,
        "wetDays": 8.1,
        "days90F": 0.6,
        "daysFreeze": 0.3
      },
      {
        "month": "Jun",
        "tHighF": 82.1,
        "tLowF": 61.3,
        "precipIn": 3.93,
        "snowIn": null,
        "wetDays": 7.0,
        "days90F": 4.0,
        "daysFreeze": 0.0
      },
      {
        "month": "Jul",
        "tHighF": 85.4,
        "tLowF": 64.4,
        "precipIn": 3.63,
        "snowIn": null,
        "wetDays": 6.5,
        "days90F": 6.4,
        "daysFreeze": 0.0
      },
      {
        "month": "Aug",
        "tHighF": 83.5,
        "tLowF": 62.3,
        "precipIn": 3.39,
        "snowIn": null,
        "wetDays": 5.8,
        "days90F": 3.5,
        "daysFreeze": 0.0
      },
      {
        "month": "Sep",
        "tHighF": 77.7,
        "tLowF": 55.2,
        "precipIn": 2.63,
        "snowIn": null,
        "wetDays": 5.7,
        "days90F": 1.9,
        "daysFreeze": 0.0
      },
      {
        "month": "Oct",
        "tHighF": 65.2,
        "tLowF": 44.5,
        "precipIn": 2.51,
        "snowIn": null,
        "wetDays": 5.6,
        "days90F": 0.1,
        "daysFreeze": 3.1
      },
      {
        "month": "Nov",
        "tHighF": 51.4,
        "tLowF": 34.4,
        "precipIn": 2.38,
        "snowIn": null,
        "wetDays": 5.1,
        "days90F": 0.0,
        "daysFreeze": 14.2
      },
      {
        "month": "Dec",
        "tHighF": 39.8,
        "tLowF": 26.2,
        "precipIn": 2.1,
        "snowIn": null,
        "wetDays": 5.2,
        "days90F": 0.0,
        "daysFreeze": 23.6
      }
    ],
    "annualPrecipIn": 33.8,
    "annualSnowIn": null,
    "fallSeason": {
      "avgHighF": 69.5,
      "avgLowF": 49.1,
      "precipIn": 10.9,
      "wetDays": 22.0
    },
    "summary": "Hottest month Jul (avg high 85.4°F), coldest Jan (avg low 20.4°F). 33.8 in of rain per year. Fall season (Aug–Nov): highs around 69.5°F, 10.9 in of rain over the season.",
    "_meta": {
      "source": "climate",
      "url": "https://www.ncei.noaa.gov/access/services/data/v1?dataset=normals-monthly-1991-2020&stations=USW00014825,USW00004850,USC00336405&dataTypes=MLY-TMAX-NORMAL,MLY-TMIN-NORMAL,MLY-PRCP-NORMAL,MLY-SNOW-NORMAL,MLY-PRCP-AVGNDS-GE010HI,MLY-TMAX-AVGNDS-GRTH090,MLY-TMIN-AVGNDS-LSTH032&format=json&units=standard",
      "asOf": "2026-09-23T19:04:59Z"
    }
  },
  "program": {
    "headCoach": {
      "name": null,
      "source": null,
      "title": null,
      "since": null,
      "seasons": null,
      "bioUrl": null,
      "social": {}
    },
    "coaches": [],
    "supportStaff": [],
    "stadium": null,
    "founded": null,
    "nationalTitles": [],
    "nationalRunnerUp": [],
    "collegeCups": [],
    "ncaaAppearances": [],
    "confRegularSeasonTitles": [],
    "confTournamentTitles": [],
    "allTimeRecord": {
      "wins": 0,
      "losses": 0,
      "ties": 0,
      "winPct": null,
      "seasons": 0
    },
    "_meta": {
      "wikipedia": null,
      "athletics": null
    }
  },
  "seasons": [],
  "roster": null,
  "rosterHistory": {},
  "schedule": null,
  "commitments": [],
  "news": null,
  "camps": null,
  "curated": {},
  "commitmentsByYear": {},
  "_build": {
    "builtAt": "2026-10-21T16:22:14Z",
    "completeness": 0.22,
    "sections": {
      "school": true,
      "climate": true,
      "program": false,
      "seasons": false,
      "rpi": false,
      "roster": false,
      "schedule": false,
      "commitments": false,
      "news": false
    },
    "stale": [],
    "failed": [],
    "skipped": [
      {
        "collector": "athletics",
        "reason": "athletics: athletics site refuses CollegeDashBot: HTTP 403 for https://www.blufftonbeavers.com/sports/womens-soccer/roster on one request in onboard run 35906785587 (d3-b4, 2026-09-23), and again in the retry run 35923659056 (2026-09-23); not worked around, #94 (registry athletics.skipReason)",
        "at": "2026-10-21T16:08:55Z"
      },
      {
        "collector": "camps",
        "reason": "camps: athletics site refuses CollegeDashBot: HTTP 403 for https://www.blufftonbeavers.com/sports/womens-soccer/roster on one request in onboard run 35906785587 (d3-b4, 2026-09-23), and again in the retry run 35923659056 (2026-09-23); not worked around, #94 (registry athletics.skipReason)",
        "at": "2026-10-21T16:08:59Z"
      },
      {
        "collector": "news",
        "reason": "news: athletics site refuses CollegeDashBot: HTTP 403 for https://www.blufftonbeavers.com/sports/womens-soccer/roster on one request in onboard run 35906785587 (d3-b4, 2026-09-23), and again in the retry run 35923659056 (2026-09-23); not worked around, #94 (registry athletics.skipReason)",
        "at": "2026-10-21T16:08:59Z"
      },
      {
        "collector": "tds",
        "reason": "tds: no TopDrawerSoccer team id in the registry (set ids.tdsClgId + ids.tdsSlug)",
        "at": "2026-10-21T16:08:55Z"
      },
      {
        "collector": "wikipedia",
        "reason": "wikipedia: no team article in the registry (most mid-majors have none; try `registry fix-wiki`)",
        "at": "2026-10-19T17:42:08Z"
      }
    ]
  }
}
