{
  "slug": "emory-henry",
  "name": "Emory & Henry University",
  "shortName": "Emory & Henry",
  "nickname": "Wasps",
  "division": "D2",
  "conference": "South Atlantic Conference",
  "colors": [
    "#1B3D75",
    "#D5AD28"
  ],
  "ids": {
    "ncaaOrgId": 216,
    "scorecardUnitId": 232025,
    "tdsClgId": null,
    "tdsSlug": null,
    "wikipedia": null,
    "ncaaName": null,
    "ncaaSlug": null,
    "rpiHistoryName": null
  },
  "social": {
    "x": null,
    "instagram": null
  },
  "links": {
    "athletics": "https://www.gowasps.com/sports/womens-soccer",
    "roster": "https://www.gowasps.com/sports/womens-soccer/roster",
    "schedule": "https://www.gowasps.com/sports/womens-soccer/schedule",
    "news": "https://www.gowasps.com/sports/womens-soccer/news",
    "camps": null,
    "tds": null,
    "wikipedia": null,
    "x": null,
    "instagram": null
  },
  "school": {
    "unitId": 232025,
    "name": "Emory & Henry University",
    "city": "Emory",
    "state": "VA",
    "zip": "24327-0947",
    "website": "www.emoryhenry.edu/",
    "lat": 36.772857,
    "lon": -81.829142,
    "localeCode": 41,
    "locale": "Rural: Fringe",
    "carnegieCode": 19,
    "carnegie": "Master's: Medium",
    "ownership": "Private nonprofit",
    "religiousAffiliation": 71,
    "undergradEnrollment": 1078,
    "gradEnrollment": null,
    "admissionRate": 0.8365,
    "sat25": 1051,
    "sat75": 1223,
    "satAverage": 1135,
    "act25": 20,
    "act75": 26,
    "tuitionInState": 39000,
    "tuitionOutOfState": 39000,
    "costOfAttendance": 52854,
    "netPriceAverage": 19061,
    "gradRate6yr": 0.5634,
    "retentionRate": 0.6627,
    "medianEarnings10yr": 47385,
    "region": "Mid-Atlantic",
    "_meta": {
      "source": "scorecard",
      "url": "https://api.data.gov/ed/collegescorecard/v1/schools?id=232025",
      "asOf": "2026-09-17T02:05:12Z"
    }
  },
  "academicRank": {
    "rank": null,
    "tied": false,
    "theSlug": null,
    "year": 2026,
    "label": "US Rank 2026",
    "source": "Times Higher Education",
    "sourceUrl": "https://www.timeshighereducation.com/student/best-universities/best-universities-united-states",
    "asOf": "2026-09-11T14:04:40Z"
  },
  "climate": {
    "lat": 36.772857,
    "lon": -81.829142,
    "timezone": "America/New_York",
    "elevationM": 528.2,
    "normalsPeriod": "1991-2020",
    "station": {
      "id": "USC00447506",
      "name": "SALTVILLE 1N",
      "state": "VA",
      "distanceKm": 14.0,
      "elevationM": 528.2
    },
    "monthly": [
      {
        "month": "Jan",
        "tHighF": 44.2,
        "tLowF": 23.2,
        "precipIn": 3.8,
        "snowIn": 1.9,
        "wetDays": 7.6,
        "days90F": 0.0,
        "daysFreeze": 24.4
      },
      {
        "month": "Feb",
        "tHighF": 48.0,
        "tLowF": 25.3,
        "precipIn": 3.77,
        "snowIn": 4.2,
        "wetDays": 7.2,
        "days90F": 0.0,
        "daysFreeze": 22.2
      },
      {
        "month": "Mar",
        "tHighF": 56.9,
        "tLowF": 31.0,
        "precipIn": 4.35,
        "snowIn": 1.6,
        "wetDays": 8.9,
        "days90F": 0.0,
        "daysFreeze": 18.1
      },
      {
        "month": "Apr",
        "tHighF": 67.5,
        "tLowF": 39.0,
        "precipIn": 4.28,
        "snowIn": 0.1,
        "wetDays": 8.3,
        "days90F": 0.1,
        "daysFreeze": 7.4
      },
      {
        "month": "May",
        "tHighF": 75.0,
        "tLowF": 48.9,
        "precipIn": 4.3,
        "snowIn": 0.0,
        "wetDays": 9.3,
        "days90F": 0.1,
        "daysFreeze": 0.8
      },
      {
        "month": "Jun",
        "tHighF": 81.5,
        "tLowF": 57.5,
        "precipIn": 4.39,
        "snowIn": 0.0,
        "wetDays": 9.8,
        "days90F": 1.3,
        "daysFreeze": 0.0
      },
      {
        "month": "Jul",
        "tHighF": 84.4,
        "tLowF": 61.8,
        "precipIn": 5.14,
        "snowIn": 0.0,
        "wetDays": 9.8,
        "days90F": 3.9,
        "daysFreeze": 0.0
      },
      {
        "month": "Aug",
        "tHighF": 83.7,
        "tLowF": 60.6,
        "precipIn": 4.53,
        "snowIn": 0.0,
        "wetDays": 8.3,
        "days90F": 3.4,
        "daysFreeze": 0.0
      },
      {
        "month": "Sep",
        "tHighF": 79.0,
        "tLowF": 54.0,
        "precipIn": 3.46,
        "snowIn": 0.0,
        "wetDays": 6.1,
        "days90F": 1.6,
        "daysFreeze": 0.0
      },
      {
        "month": "Oct",
        "tHighF": 68.8,
        "tLowF": 41.2,
        "precipIn": 2.97,
        "snowIn": 0.0,
        "wetDays": 5.4,
        "days90F": 0.1,
        "daysFreeze": 5.8
      },
      {
        "month": "Nov",
        "tHighF": 57.5,
        "tLowF": 30.6,
        "precipIn": 3.04,
        "snowIn": 0.1,
        "wetDays": 6.4,
        "days90F": 0.0,
        "daysFreeze": 19.0
      },
      {
        "month": "Dec",
        "tHighF": 47.6,
        "tLowF": 26.1,
        "precipIn": 4.12,
        "snowIn": 2.4,
        "wetDays": 8.2,
        "days90F": 0.0,
        "daysFreeze": 23.0
      }
    ],
    "annualPrecipIn": 48.1,
    "annualSnowIn": 10.3,
    "fallSeason": {
      "avgHighF": 72.2,
      "avgLowF": 46.6,
      "precipIn": 14.0,
      "wetDays": 26.0
    },
    "summary": "Hottest month Jul (avg high 84.4°F), coldest Jan (avg low 23.2°F). 48.1 in of rain per year, 10.3 in of snow. Fall season (Aug–Nov): highs around 72.2°F, 14.0 in of rain over the season.",
    "_meta": {
      "source": "climate",
      "url": "https://www.ncei.noaa.gov/access/services/data/v1?dataset=normals-monthly-1991-2020&stations=USC00447506,USC00440021,USC00444777&dataTypes=MLY-TMAX-NORMAL,MLY-TMIN-NORMAL,MLY-PRCP-NORMAL,MLY-SNOW-NORMAL,MLY-PRCP-AVGNDS-GE010HI,MLY-TMAX-AVGNDS-GRTH090,MLY-TMIN-AVGNDS-LSTH032&format=json&units=standard",
      "asOf": "2026-09-17T02:05:17Z"
    }
  },
  "program": {
    "headCoach": {
      "name": null,
      "source": null,
      "title": null,
      "since": null,
      "seasons": null,
      "bioUrl": null,
      "social": {}
    },
    "coaches": [],
    "supportStaff": [],
    "stadium": null,
    "founded": null,
    "nationalTitles": [],
    "nationalRunnerUp": [],
    "collegeCups": [],
    "ncaaAppearances": [],
    "confRegularSeasonTitles": [],
    "confTournamentTitles": [],
    "allTimeRecord": {
      "wins": 0,
      "losses": 0,
      "ties": 0,
      "winPct": null,
      "seasons": 0
    },
    "_meta": {
      "wikipedia": null,
      "athletics": null
    }
  },
  "seasons": [],
  "roster": null,
  "rosterHistory": {},
  "schedule": null,
  "commitments": [],
  "news": null,
  "camps": null,
  "curated": {},
  "commitmentsByYear": {},
  "_build": {
    "builtAt": "2026-10-30T17:36:13Z",
    "completeness": 0.22,
    "sections": {
      "school": true,
      "climate": true,
      "program": false,
      "seasons": false,
      "rpi": false,
      "roster": false,
      "schedule": false,
      "commitments": false,
      "news": false
    },
    "stale": [],
    "failed": [],
    "skipped": [
      {
        "collector": "athletics",
        "reason": "athletics: athletics site refuses CollegeDashBot: HTTP 403 for https://www.gowasps.com/ on one request, 2026-09-16 (also refused in the #137 probe and the #150 sweep; not worked around, #94) (registry athletics.skipReason)",
        "at": "2026-10-30T17:10:25Z"
      },
      {
        "collector": "camps",
        "reason": "camps: athletics site refuses CollegeDashBot: HTTP 403 for https://www.gowasps.com/ on one request, 2026-09-16 (also refused in the #137 probe and the #150 sweep; not worked around, #94) (registry athletics.skipReason)",
        "at": "2026-10-30T17:10:28Z"
      },
      {
        "collector": "news",
        "reason": "news: athletics site refuses CollegeDashBot: HTTP 403 for https://www.gowasps.com/ on one request, 2026-09-16 (also refused in the #137 probe and the #150 sweep; not worked around, #94) (registry athletics.skipReason)",
        "at": "2026-10-30T17:10:28Z"
      },
      {
        "collector": "tds",
        "reason": "tds: no TopDrawerSoccer team id in the registry (set ids.tdsClgId + ids.tdsSlug)",
        "at": "2026-10-30T17:10:25Z"
      },
      {
        "collector": "wikipedia",
        "reason": "wikipedia: no team article in the registry (most mid-majors have none; try `registry fix-wiki`)",
        "at": "2026-10-26T17:21:20Z"
      }
    ]
  }
}
